sheet_id,question_en,question_fr,file_name,survey_date,question_clean
gvhanc19,"How satisfied with government's handling of COVID-19 in country: CARD 94Overall, how satisfied are you with the [country] government's handling of the coronavirus pandemic? Please answer using this card, where 0 means extremely dissatisfied and 10 means extremely satisfied.INTERVIEWER: If the respondent cannot answer due to a change of government during the pandemic period, please select ""Don't know"".",,ESS10e03_3,2020-06-01,"How satisfied are you with your country's government handling of COVID-19? (0 = extremely dissatisfied, 10 = extremely satisfied)
If there was a change of government during the pandemic period, select ""Don't know."""
gvhlthc,"Health care for the sick, governments' responsibility: CARD 29People have different views on what the responsibilities of governments should or should not be. For each of the tasks I read out please tell me on a score of 0-10 how much responsibility you think governments should have. 0 means it should not be governments? responsibility at all and 10 means it should be entirely governments? responsibility. Firstly to... ...ensure adequate health care for the sick?READ OUT...",,ESS4e04_6,2008-06-01,"Should governments ensure adequate healthcare for the sick? (0 means not their responsibility at all, 10 means entirely their responsibility)"
gvimpc19,"To what extent trust the government to deal with the impact of COVID-19 in country: CARD 96Using this card, please tell me to what extent you trust the national government in [country] to deal with the impact of the coronavirus pandemic. Please answer on a score of 0-10 where 0 means you do not trust the government at all and 10 means you have complete trust.",,ESS10e03_3,2020-06-01,"How much do you trust your national government to handle the effects of COVID-19 in [country]? (0 = no trust, 10 = complete trust)"
gvjobc19,"How satisfied with government's response to COVID-19: people who have experienced job/income losses: CARD 94Still using this card, please tell me how satisfied you are with the government's response to the coronavirus pandemic in [country] regarding support for the following groups? Please answer on a score of 0-10, where 0 means extremely dissatisfied and 10 means extremely satisfied. People who have experienced job losses or losses of income",,ESS10e03_3,2020-06-01,"How satisfied are you with the government's response to COVID-19 for those experiencing job/income losses? (0 = extremely dissatisfied, 10 = extremely satisfied)"
gvrfgap,"Government should be generous judging applications for refugee status: ASK ALL CARD 31Some people come to this country and apply for refugee status on the grounds that they fear persecution in their own country. Using this card, please say how much you agree or disagree with the following statements. Firstly...The government should be generous in judging people's applications for refugee statusREAD OUT",,ESS8e02_3,2016-06-01,Should the government be generous when considering refugee applications?
gvspdmi,Important for democracy: government formed by single party: CARD 46How important do you think it is for democracy in general that the government is formed by a single party? Please use this card.,,ESS6e02_7,2012-06-01,Is it important for democracy that the government is formed by a single party?
gvsrdcc,"How likely, governments in enough countries take action to reduce climate change: STILL CARD 43And how likely do you think it is that governments in enough countries will take action that reduces climate change?",,ESS8e02_3,2016-06-01,How likely is it that governments in enough countries will take action to reduce climate change?
hapdkc19,"Things happened since start of COVID-19: don't know: ASK IF RESPONDENT'S D.O.B IS LATER THAN 1950 AT F3. 
CARD 100Using this card, please tell me if any of the following happened to you as a result of the coronavirus pandemic? Please include anything that has happened at any time since the start of the pandemic, even if it is no longer impacting you. Don't knowSelect all that apply.",,ESS10e03_3,2020-06-01,"Have any of these events occurred due to COVID-19 pandemic (since its start)? Select all that apply, unless your birthdate is before 1950."
hapfoc19,"Things happened since start of COVID-19: was forced to take unpaid leave/holiday: ASK IF RESPONDENT'S D.O.B IS LATER THAN 1950 AT F3. 
CARD 100Using this card, please tell me if any of the following happened to you as a result of the coronavirus pandemic? Please include anything that has happened at any time since the start of the pandemic, even if it is no longer impacting you. I was forced to take unpaid leave/holidaySelect all that apply.",,ESS10e03_3,2020-06-01,Did you have to take unpaid leave or holiday due to COVID-19? (For those born after 1950)
hapfuc19,"Things happened since start of COVID-19: was furloughed: ASK IF RESPONDENT'S D.O.B IS LATER THAN 1950 AT F3. 
CARD 100Using this card, please tell me if any of the following happened to you as a result of the coronavirus pandemic? Please include anything that has happened at any time since the start of the pandemic, even if it is no longer impacting you. I was furloughedSelect all that apply.",,ESS10e03_3,2020-06-01,Did you get furloughed due to the COVID-19 pandemic? (If respondent's D.O.B is later than 1950)
hapirc19,"Things happened since start of COVID-19: income from job was reduced : ASK IF RESPONDENT'S D.O.B IS LATER THAN 1950 AT F3. 
CARD 100Using this card, please tell me if any of the following happened to you as a result of the coronavirus pandemic? Please include anything that has happened at any time since the start of the pandemic, even if it is no longer impacting you. The income from my job was reducedSelect all that apply.",,ESS10e03_3,2020-06-01,Did your income from job get reduced due to COVID-19? (If respondent's D.O.B is later than 1950)
hapljc19,"Things happened since start of COVID-19: was made redundant/lost job: ASK IF RESPONDENT'S D.O.B IS LATER THAN 1950 AT F3. 
CARD 100Using this card, please tell me if any of the following happened to you as a result of the coronavirus pandemic? Please include anything that has happened at any time since the start of the pandemic, even if it is no longer impacting you. I was made redundant/lost my jobSelect all that apply.",,ESS10e03_3,2020-06-01,Have you lost your job or been made redundant due to the COVID-19 pandemic? (For those born after 1950)
hapnac19,"Things happened since start of COVID-19: no answer: ASK IF RESPONDENT'S D.O.B IS LATER THAN 1950 AT F3. 
CARD 100Using this card, please tell me if any of the following happened to you as a result of the coronavirus pandemic? Please include anything that has happened at any time since the start of the pandemic, even if it is no longer impacting you. No answerSelect all that apply.",,ESS10e03_3,2020-06-01,Have any of these COVID-19 related events occurred for you? (Choose all that apply)
hapnoc19,"Things happened since start of COVID-19: none of these: ASK IF RESPONDENT'S D.O.B IS LATER THAN 1950 AT F3. 
CARD 100Using this card, please tell me if any of the following happened to you as a result of the coronavirus pandemic? Please include anything that has happened at any time since the start of the pandemic, even if it is no longer impacting you. None of theseSelect all that apply.",,ESS10e03_3,2020-06-01,"Have any events related to COVID-19 occurred for you since the pandemic began (since 2020)? If so, please select all that apply."
hapnpc19,"Things happened since start of COVID-19: not applicable: ASK IF RESPONDENT'S D.O.B IS LATER THAN 1950 AT F3. 
CARD 100Using this card, please tell me if any of the following happened to you as a result of the coronavirus pandemic? Please include anything that has happened at any time since the start of the pandemic, even if it is no longer impacting you. Not applicableSelect all that apply.",,ESS10e03_3,2020-06-01,Have any of the following occurred for you due to the COVID-19 pandemic? (Choose all that apply)
hapnwc19,"Things happened since start of COVID-19: not in work since start of COVID-19: ASK IF RESPONDENT'S D.O.B IS LATER THAN 1950 AT F3. 
CARD 100Using this card, please tell me if any of the following happened to you as a result of the coronavirus pandemic? Please include anything that has happened at any time since the start of the pandemic, even if it is no longer impacting you. I have not been in work at any time since the start of the pandemicSelect all that apply.",,ESS10e03_3,2020-06-01,Have you not worked at all since the start of the COVID-19 pandemic? (For those born after 1950)
haprec19,"Things happened since start of COVID-19: refusal: ASK IF RESPONDENT'S D.O.B IS LATER THAN 1950 AT F3. 
CARD 100Using this card, please tell me if any of the following happened to you as a result of the coronavirus pandemic? Please include anything that has happened at any time since the start of the pandemic, even if it is no longer impacting you. RefusalSelect all that apply.",,ESS10e03_3,2020-06-01,"Have any of these COVID-19 related events occurred for you? (Choose all that apply)

1. Loss of job or income
2. Difficulty paying bills
3. Delayed medical treatment
4. Food insecurity
5. Mental health issues
6. Other (please specify)"
hlpcowk,"Current job: can get support/help from co-workers when needed: CARD 79Using this card, please tell me how true each of the following statements is about your current job. I can get support and help from my co-workers when needed.",,ESS5e03_6,2010-06-01,Do you feel supported by your coworkers at your current job?
hmnodm,"Humanitarian organisation etc., last 12 months: donated money: CARD 43For each of the voluntary organisations I will now mention, please use this card to tell me whether any of these things apply to you now or in the last 12 months, and, if so, which. ...an organisation for humanitarian aid, human rights, minorities, or immigrants? Donated moneyREAD OUT EACH ORGANISATION IN TURN. PROBE:'Which others?' CODE ALL THAT APPLY FOR EACH ORGANISATION",,ESS1e06_7,2002-06-01,"Have you donated money to any humanitarian organizations (for aid, human rights, minorities, or immigrants) in the last 12 months? (List each organization separately and mention any others if applicable.)"
hmnommb,"Humanitarian organisation etc., last 12 months: member: CARD 43For each of the voluntary organisations I will now mention, please use this card to tell me whether any of these things apply to you now or in the last 12 months, and, if so, which. ...an organisation for humanitarian aid, human rights, minorities, or immigrants? MemberREAD OUT EACH ORGANISATION IN TURN. PROBE:'Which others?' CODE ALL THAT APPLY FOR EACH ORGANISATION",,ESS1e06_7,2002-06-01,"Are you a member of any humanitarian organization, human rights group, minority association, or immigrant organization in the last 12 months? (Check all that apply for each organization)"
hmnona,"Humanitarian organisation etc., last 12 months: no answer: CARD 43For each of the voluntary organisations I will now mention, please use this card to tell me whether any of these things apply to you now or in the last 12 months, and, if so, which. ...an organisation for humanitarian aid, human rights, minorities, or immigrants? No answerREAD OUT EACH ORGANISATION IN TURN. PROBE:'Which others?' CODE ALL THAT APPLY FOR EACH ORGANISATION",,ESS1e06_7,2002-06-01,"Which humanitarian organizations have you supported in the last 12 months (for example, those focused on aid, human rights, minorities, or immigrants)? (Probe: 'Which others?') Please select all that apply for each organization."
hmnoptp,"Humanitarian organisation etc., last 12 months: participated: CARD 43For each of the voluntary organisations I will now mention, please use this card to tell me whether any of these things apply to you now or in the last 12 months, and, if so, which. ...an organisation for humanitarian aid, human rights, minorities, or immigrants? ParticipatedREAD OUT EACH ORGANISATION IN TURN. PROBE:'Which others?' CODE ALL THAT APPLY FOR EACH ORGANISATION",,ESS1e06_7,2002-06-01,"Have you participated in any humanitarian aid, human rights, minority, or immigrant organizations within the last 12 months? (Check all that apply for each organization)"
hmnoref,"Humanitarian organisation etc., last 12 months: refusal: CARD 43For each of the voluntary organisations I will now mention, please use this card to tell me whether any of these things apply to you now or in the last 12 months, and, if so, which. ...an organisation for humanitarian aid, human rights, minorities, or immigrants? RefusalREAD OUT EACH ORGANISATION IN TURN. PROBE:'Which others?' CODE ALL THAT APPLY FOR EACH ORGANISATION",,ESS1e06_7,2002-06-01,"Have you refused support from any humanitarian organizations, those focused on aid, human rights, minorities, or immigrants in the last 12 months? (Check all that apply for each organization)"
hmsacld,"Gay and lesbian couples right to adopt children: CARD 14Using this card, please say to what extent you agree or disagree with each of the following statements. Gay male and lesbian couples should have the same rights to adopt children as straight couples.READ OUT EACH STATEMENT",,ESS11e04_1,2023-06-01,Do you agree that gay and lesbian couples should have the same rights to adopt children as straight couples?
hscopc19,"How satisfied with the way health services coped with COVID-19 and its consequences in country: STILL CARD 94Still using this card, please tell me how satisfied you are with the way health services in [country] coped with the coronavirus pandemic and its consequences?",,ESS10e03_3,2020-06-01,How satisfied are you with the way health services in [country] handled the COVID-19 pandemic and its consequences?
icvacc19,"COVID-19 vaccine approved by national regulatory authority and available to the public in country: INTERVIEWER: IS A CORONAVIRUS VACCINE APPROVED BY THE NATIONAL REGULATORY
AUTHORITY AND AVAILABLE TO THE PUBLIC IN SLOVENIA?",,ESS10e03_3,2020-06-01,Is a COVID-19 vaccine approved by the national regulatory authority and available to the public in Slovenia?
imfljob,"Immigrants help to fill jobs where there are shortage of workers: CARD 26Using this card, please say how much you agree or disagree with each of the following statements. Firstly...People who come to live and work here help to fill jobs where there are shortages of workersREAD OUT",,ESS1e06_7,2002-06-01,Do immigrants help to fill jobs where there are worker shortages?
imgrpc,"Immigrants from outside Europe: from rich/poor countries: And what about people who come to live in [country] nowadays from countries outside Europe, would you say that ...",,ESS1e06_7,2002-06-01,"What about immigrants currently living in [country] who originate from outside Europe, are they primarily from wealthy or less affluent nations?"
impcntr,Allow many/few immigrants from poorer countries outside Europe: STILL CARD 18How about people from the poorer countries outside Europe?Use the same card.,,ESS11e04_1,2023-06-01,Should we allow many or few immigrants from poorer countries outside Europe?
impvo,"Important in life: voluntary organisations: CARD 44Looking at this card, how important is each of these things in your life. Firstly... ...voluntary organisations?READ OUT",,ESS1e06_7,2002-06-01,How important are voluntary organizations in your life?
imrcntr,Allow many/few immigrants from richer countries outside Europe: STILL CARD 24To what extent do you think [country] should allow people from the richer countries outside Europe to come and live here?Use the same card,,ESS1e06_7,2002-06-01,Should [country] allow many or few immigrants from richer countries outside Europe?
imtcjob,"Immigrants take jobs away in country or create new jobs: CARD 28Using this card, would you say that people who come to live here generally take jobs away from workers in [country], or generally help to create new jobs?",,ESS7e02_3,2014-06-01,Do immigrants mainly take jobs away or help create new jobs in [country]?
imvtctz,"Immigrants only get the right to vote in national elections once they become citizens: STILL CARD 37And still thinking generally rather than about [country], how important do you think it is for democracy in general... ....that immigrants only get the right to vote in national elections once they become citizens?READ OUT...",,ESS6e02_7,2012-06-01,Is it important for democracy that immigrants can only vote after becoming citizens?
inctxff,"Favour increase taxes on fossil fuels to reduce climate change: ASK ALL CARD 44To what extent are you in favour or against the following policies in [country] to reduce climate change? Increasing taxes on fossil fuels, such as oil, gas and coal.READ OUT EACH STATEMENT AND CODE IN GRID",,ESS8e02_3,2016-06-01,"Do you support increasing taxes on fossil fuels (oil, gas, coal) to help reduce climate change in [country]?"
jbcoedu,"Would someone applying for your job need education beyond compulsory: If someone was applying nowadays for the job you do now, would they need any education or vocational schooling beyond compulsory education?",,ESS5e03_6,2010-06-01,Do applicants for your current job require education beyond compulsory levels?
keydec,"Key decisions are made by national governments rather than the European Union: STILL CARD 35And still thinking generally rather than about [country], how important do you think it is for democracy in general... ...that key decisions are made by national governments rather than the European Union?READ OUT...",,ESS10e03_3,2020-06-01,Is it more important for key decisions to be made by national governments or the European Union for the sake of democracy in general?
keydecc,"In country key decisions are made by national governments rather than the European Union: STILL CARD 36And still using this card, please tell me to what extent you think each of the following statements applies in [country]. Key decisions in [country] are made by the national government rather than the European Union.READ OUT EACH STATEMENT",,ESS10e03_3,2020-06-01,Are key decisions in [country] primarily made by the national government or the European Union?
lklmten,"How likely, large numbers of people limit energy use: STILL CARD 43How likely do you think it is that large numbers of people will limit their energy use to try to reduce climate change?",,ESS8e02_3,2016-06-01,How likely is it that many people will limit their energy use to help combat climate change?
lkredcc,"Imagine large numbers of people limit energy use, how likely reduce climate change: CARD 43Now imagine that large numbers of people limited their energy use. How likely do you think it is that this would reduce climate change?",,ESS8e02_3,2016-06-01,How likely is it that limiting energy use by many people would help reduce climate change?
lwpeth,Law against promoting racial or ethnic hatred good/bad for a country: CARD 39How good or bad are each of these things for a country? Please use this card. Firstly...A law against promoting racial or ethnic hatredREAD OUT,,ESS1e06_7,2002-06-01,Is a law against promoting racial or ethnic hatred beneficial or harmful for a country?
mcpriv,Online/mobile communication undermines personal privacy: CARD 62To what extent would you say that online and mobile communication... ...undermines personal privacy?READ OUT...,,ESS10e03_3,2020-06-01,Does online and mobile communication undermine personal privacy to a great extent?
medcrgv,"The media are free to criticise the government: ASK ALL 
CARD 35Using this card, please tell me how important you think it is for democracy in general... ...that the media are free to criticise the government?READ OUT...",,ESS10e03_3,2020-06-01,How important is it for democracy that the media can freely criticize the government?
medcrgvc,"In country the media are free to criticise the government: CARD 36Using this card, please tell me to what extent you think each of the following statements applies in [country]. 0 means you think the statement does not apply at all and 10 means you think it applies completely. The media in [country] are free to criticise the government.READ OUT EACH STATEMENT",,ESS10e03_3,2020-06-01,How much do you agree that the media in [country] can freely criticize the government?
meprinf,"The media provide citizens with reliable information to judge the government: STILL CARD 37And still thinking generally rather than about [country], how important do you think it is for democracy in general... ...that the media provide citizens with reliable information to judge the government?READ OUT...",,ESS6e02_7,2012-06-01,How important is it for media to provide reliable information for citizens to judge governments in a democracy?
othvdm,"Other voluntary organisation, last 12 months: donated money: CARD 43For each of the voluntary organisations I will now mention, please use this card to tell me whether any of these things apply to you now or in the last 12 months, and, if so, which. ...any other voluntary organisation such as the ones I've just mentioned? Donated moneyREAD OUT EACH ORGANISATION IN TURN. PROBE:'Which others?' CODE ALL THAT APPLY FOR EACH ORGANISATION",,ESS1e06_7,2002-06-01,"Have you donated money to any other voluntary organizations in the last 12 months, besides those already mentioned? (Check all that apply)"
othvmmb,"Other voluntary organisation, last 12 months: member: CARD 43For each of the voluntary organisations I will now mention, please use this card to tell me whether any of these things apply to you now or in the last 12 months, and, if so, which. ...any other voluntary organisation such as the ones I've just mentioned? MemberREAD OUT EACH ORGANISATION IN TURN. PROBE:'Which others?' CODE ALL THAT APPLY FOR EACH ORGANISATION",,ESS1e06_7,2002-06-01,"Are you a member of any other voluntary organizations in the last 12 months, besides those already mentioned? (Check all that apply)"
othvna,"Other voluntary organisation, last 12 months: no answer: CARD 43For each of the voluntary organisations I will now mention, please use this card to tell me whether any of these things apply to you now or in the last 12 months, and, if so, which. ...any other voluntary organisation such as the ones I've just mentioned? No answerREAD OUT EACH ORGANISATION IN TURN. PROBE:'Which others?' CODE ALL THAT APPLY FOR EACH ORGANISATION",,ESS1e06_7,2002-06-01,"Have you been involved with any other voluntary organizations in the last 12 months, besides those already mentioned? (Code all that apply)"
othvnn,"Other voluntary organisation, last 12 months: none apply: CARD 43For each of the voluntary organisations I will now mention, please use this card to tell me whether any of these things apply to you now or in the last 12 months, and, if so, which. ...any other voluntary organisation such as the ones I've just mentioned? NoneREAD OUT EACH ORGANISATION IN TURN. PROBE:'Which others?' CODE ALL THAT APPLY FOR EACH ORGANISATION",,ESS1e06_7,2002-06-01,"Have you been involved in any other voluntary organizations in the last 12 months, besides those already mentioned? (Code all that apply)"
othvptp,"Other voluntary organisation, last 12 months: participated: CARD 43For each of the voluntary organisations I will now mention, please use this card to tell me whether any of these things apply to you now or in the last 12 months, and, if so, which. ...any other voluntary organisation such as the ones I've just mentioned? ParticipatedREAD OUT EACH ORGANISATION IN TURN. PROBE:'Which others?' CODE ALL THAT APPLY FOR EACH ORGANISATION",,ESS1e06_7,2002-06-01,"Have you participated in any other voluntary organizations in the last 12 months, besides those already mentioned? (Code all that apply)"
othvvw,"Other voluntary organisation, last 12 months: voluntary work: CARD 43For each of the voluntary organisations I will now mention, please use this card to tell me whether any of these things apply to you now or in the last 12 months, and, if so, which. ...any other voluntary organisation such as the ones I've just mentioned? Voluntary workREAD OUT EACH ORGANISATION IN TURN. PROBE:'Which others?' CODE ALL THAT APPLY FOR EACH ORGANISATION",,ESS1e06_7,2002-06-01,"Have you done any voluntary work for other organizations in the last 12 months, such as those already mentioned or others not listed? (Check all that apply)"
ownrdcc,"How likely, limiting own energy use reduce climate change: STILL CARD 43How likely do you think it is that limiting your own energy use would help reduce climate change?",,ESS8e02_3,2016-06-01,How likely does limiting personal energy use help in reducing climate change?
panclobo,"How important for country to close its borders when fighting a pandemic: CARD 93Using this card, how important is it for [country] to close its borders when fighting a pandemic?",,ESS10e03_3,2020-06-01,How important is it for the country to close its borders during a pandemic?
panfolru,"More important to follow government rules or to make own decisions when fighting a pandemic: ASK IF GROUP 1 AT K3
Now some more questions on different government priorities when fighting a pandemic.
ASK IF GROUP 2 AT K3
Now some questions on different government priorities when fighting a pandemic.
ASK ALL
CARD 92Is it more important for you personally to follow government rules or to make your own decisions when fighting a pandemic? Please answer on a score from 0-10 using this card, where 0 means it is much more important to follow government rules and 10 means it is much more important to make your own decisions.",,ESS10e03_3,2020-06-01,"Is it more important for you personally to follow government rules or make your own decisions during a pandemic (0 means follow government rules, 10 means make your own decisions)?"
