sheet_id,question_en,question_fr,file_name,Rechercher,question_clean
Q3_2,"Q3_2 To what extent do you agree or disagree with the following statements? In addition to communication by national authorities, the EU should play a more active role in providing timely information and guidance to citizens",,Lien_vers_fl_546_volume_B.xlsx,,"Should the EU play a more active role in providing timely information and guidance to citizens, in addition to communication by national authorities?"
Q3_4,"Q3_4 To what extent do you agree or disagree with the following statements? The EU should be provided with the necessary resources to anticipate, prepare for and respond to major crises, even if this means slightly reducing EU funding in other areas",,Lien_vers_fl_546_volume_B.xlsx,,"Should resources be allocated to the EU to prepare for major crises, potentially reducing funding in other areas, and to what extent do you agree or disagree with this?"
10,"Q3 When the EU invests in rural areas of (THIS COUNTRY), who do you think should decide how the investment is spent? | Base: All",,fl_491_volume_B.xlsx,,Who should decide how EU investments in this country's rural areas are spent?
T4,QE2.1 To what extent do you agree or disagree with each of the following statements: :- Tackling poverty in developing countries should be one of the main priorities of the EU,QE2.1 Dans quelle mesure êtes-vous d'accord ou pas d'accord avec chacune des propositions suivantes: :- Lutter contre la pauvreté dans les pays en développement devrait être une des principales priorités de l'Union européenne,ebs_512_volume_B.xlsx,,Should tackling poverty in developing countries be a main priority for the EU?
T7,QE4 To what extent do you agree or disagree with the following statement: The EU should strengthen its partnerships with African countries to create jobs and ensure sustainable development on both continents.,QE4 Dans quelle mesure êtes-vous d'accord ou pas d'accord avec la proposition suivante : l'Union européenne devrait renforcer ses partenariats avec les pays africains pour créer des emplois et s'assurer du développement durable sur les deux continents.,ebs_512_volume_B.xlsx,,Do you agree or disagree that the EU should strengthen its partnerships with African countries to create jobs and ensure sustainable development on both continents?
T6,"QA4 In your opinion, which of the following should be the main objectives of the EU in terms of agriculture and rural development policy? (MULTIPLE ANSWER POSSIBLE)","QA4 Selon vous, quelles devraient être les principaux objectifs de l'Union européenne en matière de politique agricole et de développement rural ? (PLUSIEURS REPONSES POSSIBLES)",ebs_504_volume_B.xlsx,,"What are the main objectives, in your opinion, for the EU's agriculture and rural development policy? (Multiple answers possible)"
T14,QA6 What do you think should be the two main responsibilities of farmers in our society? (TWO ANSWER MAXIMUM),"QA6 D'après vous, quelles devraient être les deux responsabilités principales des agriculteurs dans notre société ? (DEUX REPONSE MAXIMUM)",ebs_504_volume_B.xlsx,,"What are the two main responsibilities of farmers in society, according to you? (TWO ANSWER MAXIMUM)"
T31,QA16 Which two of the following should be prioritised in order to face major global challenges? MAX. 2 ANSWERS,"QA16 Parmi les éléments suivants, quels sont les deux sur lesquels notre société devrait mettre l'accent pour faire face aux principaux défis mondiaux ? MAX. 2 RÉPONSES",ebs_500_volume_B.xlsx,,What are the two priorities you believe should be focused on to address major global challenges? (Choose two options)
T72,QA31 And what should the European Union now prioritise in its response to the Coronavirus pandemic? MAX. 3 ANSWERS,QA31 Et à quoi l'Union européenne devrait-elle donner la priorité dans sa réponse à la pandémie de Coronavirus ? MAX. 3 RÉPONSES,ebs_500_volume_B.xlsx,,What should the European Union prioritize in its response to the Coronavirus pandemic (max. 3 answers)?
Q6B,Q6B In which domains should the EU invest in the next few years? | Base: All,,fl_497_volume_B.xlsx,,What domains should the EU invest in over the next few years? (All respondents)
QD9,"QD9. Which of the following information do you think should be mentioned on the label of fresh, frozen, smoked and dried fishery products?  (MULTIPLE ANSWERS POSSIBLE)","QD9. Parmi les informations suivantes, lesquelles devraient selon vous figurer sur les étiquettes des produits de la pêche tels que les produits frais, surgelés, fumés et séchés ?  (PLUSIEURS RÉPONSES POSSIBLES)",Lien_vers_ebs_515_volume_B.xlsx,,"What information should be included on the label of fresh, frozen, smoked, and dried fishery products? (Multiple answers possible)"
QD10,QD10. Which of the following information do you think should be mentioned on the label of tinned or prepared products? (MULTIPLE ANSWERS POSSIBLE),"QD10. Parmi les informations suivantes, lesquelles devraient selon vous figurer sur les étiquettes des produits en conserve ou préparés ?  (PLUSIEURS RÉPONSES POSSIBLES)",Lien_vers_ebs_515_volume_B.xlsx,,What information should be included on the label of tinned or prepared products? (Multiple answers possible)
QD11,QD11. Which of the following do you think should be mentioned on the label for all fishery and aquaculture products? (MULTIPLE ANSWERS POSSIBLE),"QD11. Parmi les informations suivantes, quelles sont celles qui devraient figurer sur les étiquettes de tous les produits de la pêche et de l’aquaculture ?  (PLUSIEURS RÉPONSES POSSIBLES)",Lien_vers_ebs_515_volume_B.xlsx,,What fishery and aquaculture products' labels should include which of the following? (Multiple answers possible)
QA11,QA11. And what should the European Union now prioritise in its response to the coronavirus pandemic? (MAX. 3 ANSWERS),QA11. Et à quoi l'UE devrait-elle maintenant donner la priorité dans sa réponse à la pandémie de coronavirus ? (MAX. 3 RÉPONSES),Lien_vers_eb_94_volume_B.xlsx,,What should the European Union prioritize in its response to the coronavirus pandemic? (Max. 3 answers)
QB5,"QB5. In your opinion, which of the following objectives should be given top priority in a European Green Deal, a set of measures to protect the environment and fight climate change? (MAX. 4 ANSWERS)","QB5. Selon vous, parmi les objectifs suivants, quels sont ceux qui devraient être prioritaires dans un Pacte Vert européen (European green deal), une série de mesures pour protéger l'environnement et combattre le changement climatique ? (MAX. 4 RÉPONSES)",Lien_vers_eb_94_volume_B.xlsx,,"Which objectives should have top priority in a European Green Deal, a set of measures to protect the environment and fight climate change? (Choose up to 4 options)"
QB8,"QB8. In your opinion, which of the following objectives should be given top priority in the European Green Deal, the EU’s plan to protect the environment and fight climate change? (MAX. 4 ANSWERS)","QB8. Selon vous, parmi les objectifs suivants, quels sont ceux qui devraient être prioritaires dans le cadre du Pacte vert européen (European Green Deal), une série de mesures de l'UE pour protéger l'environnement et combattre le changement climatique ?  (4 RÉPONSES MAX.)",Lien_vers_Eurobarometer_Standard_99_Spring_2023_volume_B.xlsx,,Which objective from the European Green Deal should receive the highest priority in protecting the environment and combating climate change? (Choose up to 4 options)
T22,QB9 In which of the following areas do you think the (NATIONALITY) government should take action to prepare the future of Europe?,"QB9 Dans quels domaines, parmi les suivants, pensez-vous que le gouvernement (NATIONALITÉ) devrait agir pour préparer l'avenir de l'Europe ?",ebs_509_volume_B.xlsx,,What areas does the (NATIONALITY) government need to act on to prepare Europe's future?
T23,QB10 In which of the following areas do you think the European Union should take action to prepare the future of Europe?,"QB10 Dans quels domaines, parmi les suivants, pensez-vous que l'Union européenne devrait agir pour préparer l'avenir de l'Europe ?",ebs_509_volume_B.xlsx,,What areas do you think the European Union should take action to prepare the future of Europe?
QB5,QB5. In which of the following areas do you think the European Union should take action to prepare the future of Europe? (MAX. 3 ANSWERS),"QB5. Dans quels domaines, parmi les suivants, pensez-vous que l'Union européenne devrait agir pour préparer l'avenir de l'Europe ? (3 RÉPONSES MAX.)",Lien_vers_SP546_volume_B.xlsx,,Which areas do you think the European Union should take action to prepare the future of Europe? (Max. 3 answers)
QB6a,"QB6a. In your opinion, in which of the following areas should the EU take measures in the medium term, i.e. in the next five years? Firstly?","QB6a. Selon vous, dans quels domaines parmi les suivants, l'UE devrait-elle prendre des mesures à moyen terme, c'est-à-dire au cours des cinq prochaines années ? En premier ?",Lien_vers_Eurobaromètre_Standard_STD102_Autumn_2024_volume_B.xlsx,,"Which areas should the EU take measures in the next five years, specifically in the short term (firstly)?"
QB6ab,"QB6ab. In your opinion, in which of the following areas should the EU take measures in the medium term, i.e. in the next five years? Firstly? And then?","QB6ab. Selon vous, dans quels domaines parmi les suivants, l'UE devrait-elle prendre des mesures à moyen terme, c'est-à-dire au cours des cinq prochaines années ? En premier ? Et ensuite ?",Lien_vers_Eurobaromètre_Standard_STD102_Autumn_2024_volume_B.xlsx,,"What areas should the EU focus on taking measures in the next five years, according to your opinion? Firstly, and then?"
QA4,"QA4. In your opinion, which of the following should be the main objectives of the EU in terms of agriculture and rural development policy?  (MULTIPLE ANSWERS POSSIBLE)","QA4. Selon vous, quelles devraient être les principaux objectifs de l'Union européenne en matière de politique agricole et de développement rural ?  (PLUSIEURS RÉPONSES POSSIBLES)",Lien_vers_CAP_2022_eb_sp_520_volume_B.xlsx,,"What are the main objectives, in your opinion, for the EU's agriculture and rural development policy? (Multiple answers possible)"
QA23,"QA23. In your opinion, considering children's needs for healthy diets, which of the following products should be distributed through the EU school scheme?  (MULTIPLE ANSWERS POSSIBLE)","QA23. D’après vous, en pensant aux besoins des enfants en matière de régime alimentaire sain, quels produits parmi les suivants devraient être distribués au titre du programme EU à destination des écoles ?  (PLUSIEURS RÉPONSES POSSIBLES)",Lien_vers_CAP_2022_eb_sp_520_volume_B.xlsx,,"Which products, considering children's need for healthy diets, should be distributed through the EU school scheme? (Multiple answers possible)"
QA25,"QA25. In your opinion, which of the following topics should be covered by the educational measures in the EU school scheme?  (MULTIPLE ANSWERS POSSIBLE)","QA25. D’après vous, quels thèmes parmi les suivants devraient être abordés par les mesures éducatives au titre du programme EU à destination des écoles ?  (PLUSIEURS RÉPONSES POSSIBLES)",Lien_vers_CAP_2022_eb_sp_520_volume_B.xlsx,,"Which topics should be included in the EU school scheme's educational measures, according to your opinion? (Multiple answers possible)"
Q6b,"Q6b Which other areas should be prioritised to receive support in addition to the one you just indicated? You can select two more areas. [MULTIPLE ANSWERS] | Base:  IF Q6a NOT EQUAL TO ""Don't know""",,Lien_vers_fl_515_volume_B.xlsx,,Which two additional areas would you prioritize for support?
Q12,Q12 The European Commission has decided to make 2022 the ‘European Year of Youth’ to support the generation that has sacrificed the most during the COVID-19 pandemic. What are the key themes you think the European Year of Youth should focus on? You can select up to three answers. [MULTIPLE ANSWERS] | Base: All,,Lien_vers_fl_502_volume_B.xlsx,,"What key themes should the European Year of Youth focus on, as a way to support the generation most affected by the COVID-19 pandemic? You can select up to three answers."
Q7,"Q7 In 2021, the life expectancy at birth in the EU was 80.1 years. As people are expected to live longer, which of the following actions should the government in [YOUR COUNTRY] take to enable you and future generations to lead an active life in old age? You can select three actions. [MULTIPLE ANSWERS]",,Lien_vers_l’évolution_démographique_en_europe_fl534_volume_B.xlsx,,"Which actions should the government in [YOUR COUNTRY] take to help you and future generations live an active life in old age, as people are expected to live longer in 2021 (EU life expectancy at birth was 80.1 years)? You can choose up to three actions."
Q9_4,"Q9_4 Governments in all euro-area countries are implementing various economic reforms, such as labour market reforms, pension, social security or healthcare reforms, reforms of education systems or market reforms to open sectors to competition. Would you agree or disagree with the following statements related to such reforms? The retirement age should be increased to ensure sustainability of the pension system | Base: All",,Lien_vers_fl_512_volume_B.xlsx,,"Should the retirement age be increased to ensure sustainability of the pension system in euro-area countries? (Regarding various economic reforms, including labour market, pension, social security, healthcare, education, and market reforms.)"
Q5_3,"Q5_3 To what extent do you agree or disagree with each of the following statements? Everyone should get vaccinated against COVID-19, it is a civic duty | Base: All",,Lien_vers_fl_505_volume_B.xlsx,,Should everyone get vaccinated against COVID-19 as a civic duty? (All)
QA3_1,"QA3.1. To what extent do you agree or disagree with the following statements about the green transition and the fight against climate change? :-You should personally do more than you currently do to contribute to the green transition and tackling climate change (by consuming less or saving energy for example), regardless of what others do.","QA3.1. Dans quelle mesure êtes-vous d’accord ou pas d’accord avec les affirmations suivantes concernant la transition écologique et la lutte contre le changement climatique ? :-Vous devriez vous-même en faire plus que ce que vous faites actuellement pour contribuer à la transition écologique et lutter contre le changement climatique (en consommant moins ou en économisant l’énergie par exemple), sans tenir compte de ce que font les autres.",Fairness_perception_green_transition_2022_ebs_527_volume_B.xlsx,,"Do you agree or disagree that you should personally do more to contribute to the green transition and fight against climate change, regardless of what others do?"
