sheet_id,question_en,question_fr,file_name,Rechercher,question_clean
QB10,QB10. The European economy is currently undergoing a green and digital transition. After the European elections this year what do you think the EU should do to ensure a fair green and digital transition?,"QB10. L'économie européenne est actuellement en cours de transition écologique et numérique. Après les élections européennes de cette année, que faudrait-il que l'UE fasse, selon vous, pour garantir une transition écologique et numérique juste ?",Lien_vers_SP546_volume_B.xlsx,,What should the EU do to ensure a fair green and digital transition after the European elections this year?
T21,"QC3 The following is a list of principles that may be important in our society. Using a scale from 0 to 10, to what extent do you agree or disagree with the following statements? '0' means that you ""totally disagree"" and '10' means that you ""totally agree"" :-No one should be condemned to the death penalty","QC3.1 Voici une liste de principes qui peuvent être importants dans notre société. Sur une échelle de 0 à 10, pourriez-vous me dire dans quelle mesure vous êtes d'accord ou pas d'accord avec les affirmations suivantes ? ""0"" signifie que vous n'êtes ""pas du tout d'accord"" et 10 que vous êtes "" tout à fait d'accord"".:-Personne ne devrait être condamné à la peine de mort",Identities_values_eb_508_volume_B.xlsx,,To what extent do you agree or disagree (on a scale of 0-10) that no one should be condemned to the death penalty?
T22,"QC3 The following is a list of principles that may be important in our society. Using a scale from 0 to 10, to what extent do you agree or disagree with the following statements? '0' means that you ""totally disagree"" and '10' means that you ""totally agree"" :-Everyone's choice of personal lifestyle and family life should be respected","QC3.2 Voici une liste de principes qui peuvent être importants dans notre société. Sur une échelle de 0 à 10, pourriez-vous me dire dans quelle mesure vous êtes d'accord ou pas d'accord avec les affirmations suivantes ? ""0"" signifie que vous n'êtes ""pas du tout d'accord"" et 10 que vous êtes "" tout à fait d'accord"".:-Les choix de chacun en matière de style de vie et de vie de famille doivent être respectés",Identities_values_eb_508_volume_B.xlsx,,To what extent do you agree or disagree (on a scale of 0-10) that everyone's choice of personal lifestyle and family life should be respected?
T23,"QC3.3 The following is a list of principles that may be important in our society. Using a scale from 0 to 10, to what extent do you agree or disagree with the following statements? '0' means that you ""totally disagree"" and '10' means that you ""totally agree"" :-Everyone should have the freedom of thought, expression and religion","QC3.3 Voici une liste de principes qui peuvent être importants dans notre société. Sur une échelle de 0 à 10, pourriez-vous me dire dans quelle mesure vous êtes d'accord ou pas d'accord avec les affirmations suivantes ? ""0"" signifie que vous n'êtes ""pas du tout d'accord"" et 10 que vous êtes "" tout à fait d'accord"".:-Tout le monde devrait jouir de la liberté de pensée, d'expression et de religion",Identities_values_eb_508_volume_B.xlsx,,"To what extent do you agree or disagree (on a scale of 0-10) that everyone should have the freedom of thought, expression, and religion?"
T24,"QC3.4 The following is a list of principles that may be important in our society. Using a scale from 0 to 10, to what extent do you agree or disagree with the following statements? '0' means that you ""totally disagree"" and '10' means that you ""totally agree"" :-Everyone should have the freedom of peaceful assembly, organization and demonstration","QC3.4 Voici une liste de principes qui peuvent être importants dans notre société. Sur une échelle de 0 à 10, pourriez-vous me dire dans quelle mesure vous êtes d'accord ou pas d'accord avec les affirmations suivantes ? ""0"" signifie que vous n'êtes ""pas du tout d'accord"" et 10 que vous êtes "" tout à fait d'accord"".:-Tout le monde devrait jouir de la liberté de réunion, d'organisation et de manifestation pacifique",Identities_values_eb_508_volume_B.xlsx,,"To what extent do you agree or disagree (on a scale of 0-10) that everyone should have the freedom of peaceful assembly, organization, and demonstration?"
T25,"QC3.5 The following is a list of principles that may be important in our society. Using a scale from 0 to 10, to what extent do you agree or disagree with the following statements? '0' means that you ""totally disagree"" and '10' means that you ""totally agree"" :-Everyone with a well-founded fear of persecution for reasons of race, religion, nationality, membership of a particular social group or political opinion should have the right to asylum","QC3.5 Voici une liste de principes qui peuvent être importants dans notre société. Sur une échelle de 0 à 10, pourriez-vous me dire dans quelle mesure vous êtes d'accord ou pas d'accord avec les affirmations suivantes ? ""0"" signifie que vous n'êtes ""pas du tout d'accord"" et 10 que vous êtes "" tout à fait d'accord"".:-Toute personne ayant une crainte légitime d'être persécutée pour des motifs de race, de religion, de nationalité, d'appartenance à un groupe social particulier ou d'opinion politique devrait avoir droit à l'asile",Identities_values_eb_508_volume_B.xlsx,,"To what extent do you agree or disagree (on a scale of 0-10) that everyone with a well-founded fear of persecution for reasons of race, religion, nationality, membership of a particular social group, or political opinion should have the right to asylum?"
T26,"QC3.6 The following is a list of principles that may be important in our society. Using a scale from 0 to 10, to what extent do you agree or disagree with the following statements? '0' means that you ""totally disagree"" and '10' means that you ""totally agree"" :-European citizens should have the right to move and work freely across national borders within the EU","QC3.6 Voici une liste de principes qui peuvent être importants dans notre société. Sur une échelle de 0 à 10, pourriez-vous me dire dans quelle mesure vous êtes d'accord ou pas d'accord avec les affirmations suivantes ? ""0"" signifie que vous n'êtes ""pas du tout d'accord"" et 10 que vous êtes "" tout à fait d'accord"".:-Les citoyens européens devraient avoir le droit de circuler et de travailler librement au-delà des frontières nationales au sein de l'UE",Identities_values_eb_508_volume_B.xlsx,,To what extent do you agree or disagree (on a scale of 0-10) that European citizens should have the right to move and work freely across national borders within the EU?
T27,"QC3.7 The following is a list of principles that may be important in our society. Using a scale from 0 to 10, to what extent do you agree or disagree with the following statements? '0' means that you ""totally disagree"" and '10' means that you ""totally agree"" :-Judges should be independent and be not under the influence of others","QC3.7 Voici une liste de principes qui peuvent être importants dans notre société. Sur une échelle de 0 à 10, pourriez-vous me dire dans quelle mesure vous êtes d'accord ou pas d'accord avec les affirmations suivantes ? ""0"" signifie que vous n'êtes ""pas du tout d'accord"" et 10 que vous êtes "" tout à fait d'accord"".:-Les juges devraient être indépendants et ne pas être sous l'influence d'autres personnes",Identities_values_eb_508_volume_B.xlsx,,To what extent do you agree or disagree (on a scale of 0-10) that judges should be independent and not under the influence of others?
T28,"QC3.8 The following is a list of principles that may be important in our society. Using a scale from 0 to 10, to what extent do you agree or disagree with the following statements? '0' means that you ""totally disagree"" and '10' means that you ""totally agree"" :-The most vulnerable citizens should be supported by their national government in order to lead a decent life.","QC3.8 Voici une liste de principes qui peuvent être importants dans notre société. Sur une échelle de 0 à 10, pourriez-vous me dire dans quelle mesure vous êtes d'accord ou pas d'accord avec les affirmations suivantes ? ""0"" signifie que vous n'êtes ""pas du tout d'accord"" et 10 que vous êtes "" tout à fait d'accord"".:-Les citoyens les plus vulnérables devraient bénéficier d'une aide de la part de leur gouvernement national pour pouvoir mener une vie décente",Identities_values_eb_508_volume_B.xlsx,,To what extent do you agree or disagree (on a scale of 0-10) that the national government should support the most vulnerable citizens to lead a decent life?
T29,"QC3.9 The following is a list of principles that may be important in our society. Using a scale from 0 to 10, to what extent do you agree or disagree with the following statements? '0' means that you ""totally disagree"" and '10' means that you ""totally agree"" :-Equality between women and men should be actively ensured in all areas","QC3.9 Voici une liste de principes qui peuvent être importants dans notre société. Sur une échelle de 0 à 10, pourriez-vous me dire dans quelle mesure vous êtes d'accord ou pas d'accord avec les affirmations suivantes ? ""0"" signifie que vous n'êtes ""pas du tout d'accord"" et 10 que vous êtes "" tout à fait d'accord"".:-L'égalité entre les hommes et les femmes devrait être activement garantie partout",Identities_values_eb_508_volume_B.xlsx,,"How much do you agree or disagree (on a scale of 0-10) that equality between women and men should be actively ensured in all areas? (0 means ""totally disagree"" and 10 means ""totally agree"")"
T30,"QC3.10 The following is a list of principles that may be important in our society. Using a scale from 0 to 10, to what extent do you agree or disagree with the following statements? '0' means that you ""totally disagree"" and '10' means that you ""totally agree"" :-There should be no discrimination on any grounds, including sex, age, ethnicity, religion, political or other opinion, membership of a minority, wealth, disability or sexual orientation","QC3.10 Voici une liste de principes qui peuvent être importants dans notre société. Sur une échelle de 0 à 10, pourriez-vous me dire dans quelle mesure vous êtes d'accord ou pas d'accord avec les affirmations suivantes ? ""0"" signifie que vous n'êtes ""pas du tout d'accord"" et 10 que vous êtes "" tout à fait d'accord"".:-Il ne devrait y avoir aucune discrimination quel qu'en soit le motif, notamment le sexe, l'âge, l'origine ethnique, la religion, l'opinion politique ou autre, l'appartenance à une minorité, la richesse, le handicap ou l'orientation sexuelle",Identities_values_eb_508_volume_B.xlsx,,"To what extent do you agree or disagree (on a scale of 0-10) that there should be no discrimination on any grounds, including sex, age, ethnicity, religion, political or other opinion, membership of a minority, wealth, disability, or sexual orientation?"
T31,"QC3.11 The following is a list of principles that may be important in our society. Using a scale from 0 to 10, to what extent do you agree or disagree with the following statements? '0' means that you ""totally disagree"" and '10' means that you ""totally agree"" :-The law should treat everyone equally and everyone should have the right to a fair trial in an independent court","QC3.11 Voici une liste de principes qui peuvent être importants dans notre société. Sur une échelle de 0 à 10, pourriez-vous me dire dans quelle mesure vous êtes d'accord ou pas d'accord avec les affirmations suivantes ? ""0"" signifie que vous n'êtes ""pas du tout d'accord"" et 10 que vous êtes "" tout à fait d'accord"".:-La loi devrait traiter tout le monde de façon égale et chacun devrait avoir droit à un procès juste par un tribunal indépendant",Identities_values_eb_508_volume_B.xlsx,,How much do you agree or disagree (on a scale of 0-10) that everyone should have equal treatment under the law and the right to a fair trial in an independent court?
Q8,"Q8 Do you think that the degree to which economic policy, including budgetary policies, is coordinated in the euro area is appropriate? Should there be more or less coordination among euro-area governments? | Base: All",,Lien_vers_fl_512_volume_B.xlsx,,"Is the coordination of economic policy, including budgetary policies, among euro-area governments appropriate? Should there be more or less coordination? (All respondents)"
T87,QA24 And what should the European Union now prioritise in its response to the Coronavirus outbreak? (N),QA24 Et à quoi l'Union européenne devrait-elle donner la priorité dans sa réponse à l'épidémie de Coronavirus ?,eb_93_volume_B.xlsx,,What should the European Union prioritize in its response to the Coronavirus outbreak?
T91,"QA26a.3 Thinking about the consequences of the Coronavirus outbreak, please tell me to what extent you agree or disagree or totally disagree with the following statements ? (N):-The EU should put in place an economic plan to help all EU Member States recover","QA26a.3 En pensant aux conséquences de l'épidémie de Coronavirus, veuillez me dire dans quelle mesure vous être d'accord ou non avec les affirmations suivantes. :-L'Union européenne devrait mettre en place un plan économique pour aider tous les États membres à se rétablir",eb_93_volume_B.xlsx,,To what extent do you agree or disagree or totally disagree with the statement: The EU should put in place an economic plan to help all EU Member States recover from the Coronavirus outbreak? (N)
T92,"QA26a.4 Thinking about the consequences of the Coronavirus outbreak, please tell me to what extent you agree or disagree or totally disagree with the following statements ? (N):-The EU should become less dependent on other countries in the world to cover its critical needs (e.g. medical and pharmaceutical goods)","QA26a.4 En pensant aux conséquences de l'épidémie de Coronavirus, veuillez me dire dans quelle mesure vous être d'accord ou non avec les affirmations suivantes. :-L'Union européenne devrait devenir moins dépendante des autres pays dans le monde pour couvrir ses besoins essentiels (par exemple les produits médicaux et pharmaceutiques)",eb_93_volume_B.xlsx,,To what extent do you agree or disagree or totally disagree that the EU should become less dependent on other countries for critical needs like medical and pharmaceutical goods due to the Coronavirus outbreak?
T95,"QA26a.7 Thinking about the consequences of the Coronavirus outbreak, please tell me to what extent you agree or disagree or totally disagree with the following statements ? (N):-The EU should be given the means to better deal in the future with crises, such as the Coronavirus outbreak","QA26a.7 En pensant aux conséquences de l'épidémie de Coronavirus, veuillez me dire dans quelle mesure vous être d'accord ou non avec les affirmations suivantes. :-Il faudrait donner à l'Union européenne les moyens de mieux gérer les crises telles que l'épidémie de Coronavirus à l'avenir",eb_93_volume_B.xlsx,,"To what extent do you agree or disagree or totally disagree with the statement: The EU should be given the means to better deal with future crises, such as the Coronavirus outbreak?"
Q3_8,Q3_8 How much do you agree or disagree with each of the following statements? Ukraine should join the EU when it is ready,,fl_506_volume_B.xlsx,,Do you agree or disagree with each of the following statements? Should Ukraine join the EU when it's ready?
Q3_10,Q3_10 How much do you agree or disagree with each of the following statements? A distinction should be made between the Russian leadership and Russian people,,fl_506_volume_B.xlsx,,Do you agree or disagree that a distinction should be made between the Russian leadership and the Russian people?
Q6_1,Q6_1 How much do you agree or disagree with each of the following statements? The EU should reduce its dependency on Russian gas and oil as soon as possible,,fl_506_volume_B.xlsx,,Should the EU reduce its dependency on Russian gas and oil as soon as possible? (Agree/Disagree)
Q6_3,"Q6_3 How much do you agree or disagree with each of the following statements? The EU should take measures to increase energy efficiency of buildings, transport, and goods",,fl_506_volume_B.xlsx,,"Do you agree or disagree with the following statements? Should the EU take measures to increase energy efficiency in buildings, transport, and goods?"
Q6_4,Q6_4 How much do you agree or disagree with each of the following statements? Measures should be taken at the European level to limit the impact of rising energy prices on consumers and companies,,fl_506_volume_B.xlsx,,Agree or disagree: Should measures be taken at the European level to mitigate the impact of rising energy prices on consumers and companies?
Q6_6,Q6_6 How much do you agree or disagree with each of the following statements? Gas storage in the EU should be filled up to avoid risks of shortage for next winter,,fl_506_volume_B.xlsx,,Do you agree or disagree with each statement about gas storage in the EU? Should gas storage be filled to prevent winter shortages?
Q6_7,Q6_7 How much do you agree or disagree with each of the following statements? EU Member States should jointly buy gas from other countries in order to get a better price,,fl_506_volume_B.xlsx,,Do you agree or disagree that EU Member States should jointly purchase gas from other countries to secure better prices?
QD3_4,QD3.4. Please tell to what extent you agree or disagree with each of the following statements.:-Co-operation in defence matters at EU level should be increased,QD3.4. Veuillez indiquer dans quelle mesure vous êtes d'accord ou pas d'accord avec chacune des affirmations suivantes. :-La coopération dans le domaine de la défense devrait être renforcée au niveau de l'UE,Lien_vers_Eurobaromètre_Standard_STD102_Autumn_2024_volume_B.xlsx,,To what extent do you agree or disagree that co-operation in defence matters at EU level should be increased?
QD3_5,QD3.5. Please tell to what extent you agree or disagree with each of the following statements.:-More money should be spent on defence in the EU,QD3.5. Veuillez indiquer dans quelle mesure vous êtes d'accord ou pas d'accord avec chacune des affirmations suivantes. :-Le budget de la défense devrait être augmenté dans l'UE,Lien_vers_Eurobaromètre_Standard_STD102_Autumn_2024_volume_B.xlsx,,To what extent do you agree or disagree that more money should be spent on defense in the EU?
QD3_6,QD3.6. Please tell to what extent you agree or disagree with each of the following statements.:-Member States’ purchase of military equipment should be better coordinated,QD3.6. Veuillez indiquer dans quelle mesure vous êtes d'accord ou pas d'accord avec chacune des affirmations suivantes. :-Les achats d'équipements militaires des États membres devraient être mieux coordonnés,Lien_vers_Eurobaromètre_Standard_STD102_Autumn_2024_volume_B.xlsx,,To what extent do you agree or disagree that Member States' purchase of military equipment should be better coordinated?
QD3_12,QD3.12. Please tell to what extent you agree or disagree with each of the following statements.:-EU Member States should jointly buy energy from other countries to get a better price,QD3.12. Veuillez indiquer dans quelle mesure vous êtes d'accord ou pas d'accord avec chacune des affirmations suivantes. :-Les États membres de l'UE devraient acheter en commun l'énergie à d'autres pays pour obtenir de meilleurs prix,Lien_vers_Eurobaromètre_Standard_STD102_Autumn_2024_volume_B.xlsx,,Do you agree or disagree with the statement that EU Member States should jointly purchase energy from other countries to secure better prices?
QA1_2,QA1.2. To what extent do you agree or disagree with the following statements? :-The green transition should not leave anyone behind,QA1.2. Dans quelle mesure êtes-vous d’accord ou pas d’accord avec les affirmations suivantes ? :-La transition écologique ne devrait laisser personne de côté,Fairness_perception_green_transition_2022_ebs_527_volume_B.xlsx,,Do you agree or disagree that the green transition should not leave anyone behind?
Q2_2,Q2_2 To what extent do you agree or disagree with the following statements? Domestic violence is a private matter and should be handled within the family,,Lien_vers_les_stéréotypes_de_genre_-_Violence_à_l'égard_des_femmes_FL544_volume_B.xlsx,,Is domestic violence a private matter or should it be addressed outside the family?
Q3_1,"Q3_1 To what extent do you agree or disagree with the following statements? If women share their opinion on social media, they should accept that they elicit sexist, demeaning and / or abusive replies",,Lien_vers_les_stéréotypes_de_genre_-_Violence_à_l'égard_des_femmes_FL544_volume_B.xlsx,,"Do women who share their opinions on social media expect to receive sexist, demeaning, or abusive responses?"
Q8_4,Q8_4 Please tell me to what extent you agree or disagree with the following statements: EU Member States should cooperate closely to help EU citizens who need consular protection outside the EU | Base: All,,Lien_vers_fl_528_volume_B.xlsx,,Should all EU Member States cooperate closely to help EU citizens who need consular protection outside the EU?
Q10_2,Q10_2 The following statements are about interference by foreign countries in the politics and democracy of the European Union and its Member States. To what extent do you agree or disagree with each of the statements? Foreign interference in our democratic systems is a serious problem that should be addressed | Base: All,,Lien_vers_fl_528_volume_B.xlsx,,Is foreign interference in the democratic systems of the European Union and its Member States a serious problem that should be addressed? (All respondents)
Q10_3,Q10_3 The following statements are about interference by foreign countries in the politics and democracy of the European Union and its Member States. To what extent do you agree or disagree with each of the statements? Entities representing foreign governments on EU territory should be registered to prevent covert interference in our democratic systems | Base: All,,Lien_vers_fl_528_volume_B.xlsx,,Are you for or against the registration of entities representing foreign governments on EU territory to prevent covert interference in our democratic systems? (Regarding interference by foreign countries in the politics and democracy of the European Union and its Member States)
Q6a,"Q6a The EU Recovery Plan ‘NextGenerationEU’ supports Member States in different areas. In your view, which area should receive the most EU support? | Base: All",,Lien_vers_fl_515_volume_B.xlsx,,Which area should receive the most EU support according to the EU Recovery Plan 'NextGenerationEU'? (Multiple answers possible)
T48,QC11c.1 Do you think that these products should be regulated as strictly as cigarettes? (ONE ANSWER ONLY):-E-cigarettes,QC11c.1 Pensez-vous que ces produits devraient être réglementés aussi strictement que les cigarettes ? (UNE SEULE REPONSE):-Cigarettes électroniques,ebs_506_volume_B_EU27+UK.xlsx,,Should e-cigarettes be regulated as strictly as cigarettes? (ONE ANSWER ONLY)
T49,QC11c.2 Do you think that these products should be regulated as strictly as cigarettes? (ONE ANSWER ONLY):-Heated tobacco products,QC11c.2 Pensez-vous que ces produits devraient être réglementés aussi strictement que les cigarettes ? (UNE SEULE REPONSE):-Produits du tabac chauffés,ebs_506_volume_B_EU27+UK.xlsx,,Should heated tobacco products be regulated as strictly as cigarettes? (ONE ANSWER)
Q4,Q4 Should managing demographic change (such as population ageing and a shrinking workforce) remain a political priority for policy action?,,Lien_vers_l’évolution_démographique_en_europe_fl534_volume_B.xlsx,,Is managing demographic change (like population ageing and a shrinking workforce) still a political priority for policy action?
T12,"QB4 In a pre-election period, traditional media usually have to observe a number of rules, such as observing silence periods just before the elections, ensuring equal campaigning time for the different candidates or strict rules on funding for the campaign. Do you think that these rules should also apply to online social networks, internet platforms and actors using them?","QB4 En période préélectorale, les médias traditionnels doivent habituellement observer un certain nombre de règles, comme respecter des périodes de silence juste avant les élections, garantir un temps de parole équitable aux différents candidats qui font campagne, ou se conformer à des règles strictes concernant le financement de la campagne. Pensez-vous que ces règles devraient s'appliquer aux réseaux sociaux en ligne, aux plateformes Internet et aux acteurs qui les utilisent ?",Lien_vers_ebs_507_volume_B.xlsx,,"Should rules for traditional media during pre-election periods, such as silence periods, equal campaigning time, and funding rules, also apply to online social networks, internet platforms, and their users?"
Q3_1,"Q3_1 To what extent do you agree or disagree with the following statements? The EU should be more involved in preparedness efforts for future crises, through actions such as raising awareness, organising training and crisis simulation exercises",,Lien_vers_fl_546_volume_B.xlsx,,"Should you agree or disagree, should the EU increase its involvement in preparing for future crises by raising awareness, organizing training, and conducting crisis simulation exercises?"
